Sheet: Tester Optimizator Results
A1: Pass | B1: Result | C1: Profit | D1: Expected Payoff | E1: Profit Factor | F1: Recovery Factor | G1: Sharpe Ratio | H1: Custom | I1: Equity DD % | J1: Trades | K1: EntryZScore | L1: StopLossPercent | M1: RESULT
A2: 66 | B2: 1.29 | C2: 2262.83 | D2: 41.904259000000003 | E2: 1.366765 | F2: 4.1031209999999998 | G2: 1.292602 | H2: 0 | I2: 3.6707000000000001 | J2: 54 | K2: 1.6 | L2: 0.9 | M2: =(RC[-10]*RC[-6])/RC[-4] -> 796.83400541041215
A3: 57 | B3: -5 | C3: -13.45 | D3: -0.17697399999999999 | E3: 0.79056400000000004 | F3: -0.717333 | G3: -5 | H3: 0 | I3: 0.125 | J3: 76 | K3: 2.4 | L3: 0 | M3: =(RC[-10]*RC[-6])/RC[-4] -> 538
A4: 99 | B4: 0.89 | C4: 6932.08 | D4: 88.872821000000002 | E4: 1.1726669999999999 | F4: 2.1993830000000001 | G4: 0.88949900000000004 | H4: 0 | I4: 14.6113 | J4: 78 | K4: 1.7 | L4: 2.8 | M4: =(RC[-10]*RC[-6])/RC[-4] -> 422.0075029545626
A5: 37 | B5: 1.0900000000000001 | C5: 7200.01 | D5: 97.297432000000001 | E5: 1.156784 | F5: 1.182178 | G5: 1.0907 | H5: 0 | I5: 24.851800000000001 | J5: 74 | K5: 2.1 | L5: 2.9 | M5: =(RC[-10]*RC[-6])/RC[-4] -> 315.99525615850763
A6: 120 | B6: 1.0900000000000001 | C6: 6875.24 | D6: 92.908648999999997 | E6: 1.1572119999999999 | F6: 1.178337 | G6: 1.08904 | H6: 0 | I6: 24.2256 | J6: 74 | K6: 2.1 | L6: 2.8 | M6: =(RC[-10]*RC[-6])/RC[-4] -> 309.07021372432467
A7: 74 | B7: 1.0900000000000001 | C7: 6604.23 | D7: 89.246351000000004 | E7: 1.1567799999999999 | F7: 1.188083 | G7: 1.089032 | H7: 0 | I7: 23.426400000000001 | J7: 74 | K7: 2.1 | L7: 2.7 | M7: =(RC[-10]*RC[-6])/RC[-4] -> 307.01336122323528
A8: 53 | B8: 1.1000000000000001 | C8: 5783.07 | D8: 78.149595000000005 | E8: 1.158925 | F8: 1.216577 | G8: 1.095944 | H8: 0 | I8: 21.083400000000001 | J8: 74 | K8: 2.1 | L8: 2.4 | M8: =(RC[-10]*RC[-6])/RC[-4] -> 300.6118969464128
A9: 76 | B9: 1.07 | C9: 4436.22 | D9: 59.948918999999997 | E9: 1.162523 | F9: 1.253304 | G9: 1.071569 | H9: 0 | I9: 17.131 | J9: 74 | K9: 2.1 | L9: 1.9 | M9: =(RC[-10]*RC[-6])/RC[-4] -> 277.49202201739541
A10: 88 | B10: -1.95 | C10: -1204.2 | D10: -40.14 | E10: 0.68604600000000004 | F10: -0.897478 | G10: -1.9456549999999999 | H10: 0 | I10: 8.8686000000000007 | J10: 30 | K10: 2.7 | L10: 0.8 | M10: =(RC[-10]*RC[-6])/RC[-4] -> 264.18575096407545
A11: 140 | B11: -1.92 | C11: -2167.06 | D11: -72.235332999999997 | E11: 0.69595700000000005 | F11: -0.89297000000000004 | G11: -1.920204 | H11: 0 | I11: 15.9186 | J11: 30 | K11: 2.7 | L11: 1.5 | M11: =(RC[-10]*RC[-6])/RC[-4] -> 261.40472656138098
A12: 137 | B12: -1.78 | C12: -1793.57 | D12: -64.056071000000003 | E12: 0.73600500000000002 | F12: -0.87215500000000001 | G12: -1.779881 | H12: 0 | I12: 13.4895 | J12: 28 | K12: 2.8 | L12: 1.5 | M12: =(RC[-10]*RC[-6])/RC[-4] -> 236.65377998962154
A13: 107 | B13: 1.06 | C13: 4191.57 | D13: 58.216250000000002 | E13: 1.1585639999999999 | F13: 0.80815099999999995 | G13: 1.0628299999999999 | H13: 0 | I13: 21.536000000000001 | J13: 72 | K13: 2.2000000000000002 | L13: 2.1 | M13: =(RC[-10]*RC[-6])/RC[-4] -> 206.85950701615894
A14: 96 | B14: -2.6 | C14: -8.16 | D14: -8.6808999999999997E-2 | E14: 0.90034199999999998 | F14: -0.51159900000000003 | G14: -2.5987089999999999 | H14: 0 | I14: 0.10630000000000001 | J14: 94 | K14: 2.2999999999999998 | L14: 0 | M14: =(RC[-10]*RC[-6])/RC[-4] -> 199.48697497648166
A15: 58 | B15: 1.05 | C15: 2707.19 | D15: 37.599860999999997 | E15: 1.1657630000000001 | F15: 0.88786200000000004 | G15: 1.0493490000000001 | H15: 0 | I15: 14.819699999999999 | J15: 72 | K15: 2.2000000000000002 | L15: 1.4 | M15: =(RC[-10]*RC[-6])/RC[-4] -> 191.68992080204058
A16: 59 | B16: -1.33 | C16: -752.33 | D16: -47.020625000000003 | E16: 0.67672200000000005 | F16: -0.84365599999999996 | G16: -1.3302719999999999 | H16: 0 | I16: 5.9099000000000004 | J16: 16 | K16: 3 | L16: 0.7 | M16: =(RC[-10]*RC[-6])/RC[-4] -> 169.34356482512393
A17: 78 | B17: -1.3 | C17: -947.2 | D17: -59.2 | E17: 0.68470500000000001 | F17: -0.838646 | G17: -1.299383 | H17: 0 | I17: 7.4717000000000002 | J17: 16 | K17: 3 | L17: 0.9 | M17: =(RC[-10]*RC[-6])/RC[-4] -> 164.72497257652205
A18: 20 | B18: -1.21 | C18: -273.14 | D18: -13.657 | E18: 0.75477799999999995 | F18: -0.88463499999999995 | G18: -1.207964 | H18: 0 | I18: 2.0565000000000002 | J18: 20 | K18: 2.9 | L18: 0.3 | M18: =(RC[-10]*RC[-6])/RC[-4] -> 160.43923508874298
A19: 12 | B19: -1.1200000000000001 | C19: -83.06 | D19: -4.1529999999999996 | E19: 0.76807300000000001 | F19: -0.88986500000000002 | G19: -1.1170580000000001 | H19: 0 | I19: 0.62209999999999999 | J19: 20 | K19: 2.9 | L19: 0.1 | M19: =(RC[-10]*RC[-6])/RC[-4] -> 149.14457077640253
A20: 35 | B20: 0.6 | C20: 947.48 | D20: 15.791333 | E20: 1.1025020000000001 | F20: 1.6186 | G20: 0.600468 | H20: 0 | I20: 3.8995000000000002 | J20: 60 | K20: 0.6 | L20: 0.9 | M20: =(RC[-10]*RC[-6])/RC[-4] -> 145.89855638928069
A21: 9 | B21: 0.86 | C21: 266.95 | D21: 6.0670450000000002 | E21: 1.2583850000000001 | F21: 1.027798 | G21: 0.86056600000000005 | H21: 0 | I21: 1.7259 | J21: 44 | K21: 1.7 | L21: 0.2 | M21: =(RC[-10]*RC[-6])/RC[-4] -> 133.10625974853701
A22: 103 | B22: -1.27 | C22: -1473.71 | D22: -66.986818 | E22: 0.817666 | F22: -0.63685599999999998 | G22: -1.267455 | H22: 0 | I22: 14.7775 | J22: 22 | K22: 2.9 | L22: 2.5 | M22: =(RC[-10]*RC[-6])/RC[-4] -> 126.39899225511758
A23: 27 | B23: 0.61 | C23: 2929.69 | D23: 50.511896999999998 | E23: 1.1356539999999999 | F23: 1.1645760000000001 | G23: 0.61288900000000002 | H23: 0 | I23: 14.232799999999999 | J23: 58 | K23: 0.8 | L23: 2.5 | M23: =(RC[-10]*RC[-6])/RC[-4] -> 126.15752166896185
A24: 28 | B24: -0.94 | C24: -1907.05 | D24: -56.089706 | E24: 0.73471200000000003 | F24: -0.72833800000000004 | G24: -0.94007600000000002 | H24: 0 | I24: 17.006599999999999 | J24: 34 | K24: 1.8 | L24: 1.4 | M24: =(RC[-10]*RC[-6])/RC[-4] -> 105.41624638669693
A25: 79 | B25: 0.63 | C25: 3396.35 | D25: 70.757292000000007 | E25: 1.1465369999999999 | F25: 0.81029099999999998 | G25: 0.631552 | H25: 0 | I25: 20.883500000000002 | J25: 48 | K25: 1.8 | L25: 2.5 | M25: =(RC[-10]*RC[-6])/RC[-4] -> 102.71130965594847
A26: 93 | B26: -0.95 | C26: -1940.78 | D26: -138.62714299999999 | E26: 0.66165700000000005 | F26: -0.67133200000000004 | G26: -0.94730599999999998 | H26: 0 | I26: 18.3093 | J26: 14 | K26: 3.1 | L26: 2.2999999999999998 | M26: =(RC[-10]*RC[-6])/RC[-4] -> 100.41413591344289
A27: 91 | B27: -1.0900000000000001 | C27: -1936.91 | D27: -60.528436999999997 | E27: 0.85041999999999995 | F27: -0.49591400000000002 | G27: -1.093496 | H27: 0 | I27: 23.064900000000002 | J27: 32 | K27: 2.8 | L27: 2.9 | M27: =(RC[-10]*RC[-6])/RC[-4] -> 91.827987000160405
A28: 101 | B28: -1.04 | C28: -1171.18 | D28: -36.599375000000002 | E28: 0.85399800000000003 | F28: -0.48943599999999998 | G28: -1.0363880000000001 | H28: 0 | I28: 14.7719 | J28: 32 | K28: 2.8 | L28: 1.8 | M28: =(RC[-10]*RC[-6])/RC[-4] -> 82.169314566169561
A29: 21 | B29: 0.63 | C29: 2393.46 | D29: 30.685385 | E29: 1.090937 | F29: 0.69924900000000001 | G29: 0.62917699999999999 | H29: 0 | I29: 18.815100000000001 | J29: 78 | K29: 2 | L29: 1.9 | M29: =(RC[-10]*RC[-6])/RC[-4] -> 80.037309523733597
A30: 122 | B30: -0.77 | C30: -665.83 | D30: -47.559286 | E30: 0.69200300000000003 | F30: -0.65280700000000003 | G30: -0.77245799999999998 | H30: 0 | I30: 6.6688000000000001 | J30: 14 | K30: 3.1 | L30: 0.8 | M30: =(RC[-10]*RC[-6])/RC[-4] -> 77.124176784428997
A31: 113 | B31: 0.49 | C31: 70.88 | D31: 1.54087 | E31: 1.1067940000000001 | F31: 1.0373190000000001 | G31: 0.49029800000000001 | H31: 0 | I31: 0.4531 | J31: 46 | K31: 1.3 | L31: 0.1 | M31: =(RC[-10]*RC[-6])/RC[-4] -> 76.699011785477808
A32: 112 | B32: -0.77 | C32: -579.09 | D32: -41.363571 | E32: 0.690743 | F32: -0.64766500000000005 | G32: -0.77005900000000005 | H32: 0 | I32: 5.8579999999999997 | J32: 14 | K32: 3.1 | L32: 0.7 | M32: =(RC[-10]*RC[-6])/RC[-4] -> 76.123841978490958
A33: 60 | B33: 0.45 | C33: 549.11 | D33: 14.450263 | E33: 1.1060410000000001 | F33: 0.938056 | G33: 0.45161600000000002 | H33: 0 | I33: 3.7170000000000001 | J33: 38 | K33: 1.1000000000000001 | L33: 0.8 | M33: =(RC[-10]*RC[-6])/RC[-4] -> 66.716938864675811
A34: 127 | B34: 0.46 | C34: 1602.93 | D34: 29.683889000000001 | E34: 1.0932170000000001 | F34: 0.79819200000000001 | G34: 0.46333400000000002 | H34: 0 | I34: 11.4451 | J34: 54 | K34: 0 | L34: 2.1 | M34: =(RC[-10]*RC[-6])/RC[-4] -> 64.891697636543157
A35: 132 | B35: -0.59 | C35: -1209.72 | D35: -40.323999999999998 | E35: 0.83181000000000005 | F35: -0.67326399999999997 | G35: -0.586534 | H35: 0 | I35: 11.8378 | J35: 30 | K35: 1.5 | L35: 1.6 | M35: =(RC[-10]*RC[-6])/RC[-4] -> 59.938663474632115
A36: 111 | B36: 0.46 | C36: 63.24 | D36: 1.86 | E36: 1.1121259999999999 | F36: 0.85749200000000003 | G36: 0.462395 | H36: 0 | I36: 0.48930000000000001 | J36: 34 | K36: 0.5 | L36: 0.1 | M36: =(RC[-10]*RC[-6])/RC[-4] -> 59.762640098099325
A37: 110 | B37: 0.46 | C37: 63.24 | D37: 1.86 | E37: 1.1121259999999999 | F37: 0.85749200000000003 | G37: 0.462395 | H37: 0 | I37: 0.48930000000000001 | J37: 34 | K37: 0.1 | L37: 0.1 | M37: =(RC[-10]*RC[-6])/RC[-4] -> 59.762640098099325
A38: 77 | B38: 0.46 | C38: 63.24 | D38: 1.86 | E38: 1.1121259999999999 | F38: 0.85749200000000003 | G38: 0.462395 | H38: 0 | I38: 0.48930000000000001 | J38: 34 | K38: 0 | L38: 0.1 | M38: =(RC[-10]*RC[-6])/RC[-4] -> 59.762640098099325
A39: 43 | B39: 0.75 | C39: 1374.77 | D39: 23.702931 | E39: 1.0993869999999999 | F39: 0.40476200000000001 | G39: 0.74831899999999996 | H39: 0 | I39: 17.3462 | J39: 58 | K39: 2.4 | L39: 1.6 | M39: =(RC[-10]*RC[-6])/RC[-4] -> 59.307889429961605
A40: 7 | B40: -0.7 | C40: -2004.18 | D40: -37.114443999999999 | E40: 0.867807 | F40: -0.53250799999999998 | G40: -0.70318899999999995 | H40: 0 | I40: 24.3216 | J40: 54 | K40: 1.8 | L40: 1.7 | M40: =(RC[-10]*RC[-6])/RC[-4] -> 57.945091195480558
A41: 125 | B41: -0.8 | C41: -35.409999999999997 | D41: -2.1330999999999999E-2 | E41: 0.97723700000000002 | F41: -0.45397399999999999 | G41: -0.79712400000000005 | H41: 0 | I41: 0.51880000000000004 | J41: 1660 | K41: 0 | L41: 0 | M41: =(RC[-10]*RC[-6])/RC[-4] -> 54.40663230531996
A42: 34 | B42: 0.41 | C42: 549.98 | D42: 14.473158 | E42: 1.0949759999999999 | F42: 0.83372000000000002 | G42: 0.40691699999999997 | H42: 0 | I42: 4.1749999999999998 | J42: 38 | K42: 1.1000000000000001 | L42: 0.9 | M42: =(RC[-10]*RC[-6])/RC[-4] -> 53.603883032335325
A43: 40 | B43: 0.41 | C43: 549.98 | D43: 14.473158 | E43: 1.0949759999999999 | F43: 0.83372000000000002 | G43: 0.40691699999999997 | H43: 0 | I43: 4.1749999999999998 | J43: 38 | K43: 1.2 | L43: 0.9 | M43: =(RC[-10]*RC[-6])/RC[-4] -> 53.603883032335325
A44: 16 | B44: 0.56999999999999995 | C44: 871.63 | D44: 12.451857 | E44: 1.0835459999999999 | F44: 0.53642400000000001 | G44: 0.57008700000000001 | H44: 0 | I44: 9.7289999999999992 | J44: 70 | K44: 2.1 | L44: 0.8 | M44: =(RC[-10]*RC[-6])/RC[-4] -> 51.074615254394082
A45: 129 | B45: 0.39 | C45: 654.25 | D45: 11.280172 | E45: 1.0769709999999999 | F45: 0.80284900000000003 | G45: 0.39225500000000002 | H45: 0 | I45: 5.0834000000000001 | J45: 58 | K45: 0 | L45: 1 | M45: =(RC[-10]*RC[-6])/RC[-4] -> 50.484485531337299
A46: 73 | B46: 0.66 | C46: 2328.69 | D46: 40.149827999999999 | E46: 1.0814969999999999 | F46: 0.31488699999999997 | G46: 0.65526499999999999 | H46: 0 | I46: 30.375299999999999 | J46: 58 | K46: 2.4 | L46: 3 | M46: =(RC[-10]*RC[-6])/RC[-4] -> 50.235192832663387
A47: 33 | B47: 0.54 | C47: 2309.0300000000002 | D47: 36.078594000000002 | E47: 1.0788040000000001 | F47: 0.37006099999999997 | G47: 0.54337299999999999 | H47: 0 | I47: 26.8841 | J47: 64 | K47: 2.2999999999999998 | L47: 2.7 | M47: =(RC[-10]*RC[-6])/RC[-4] -> 46.669390390230667
A48: 75 | B48: 0.53 | C48: 621.38 | D48: 9.4148479999999992 | E48: 1.082492 | F48: 0.49049599999999999 | G48: 0.52628399999999997 | H48: 0 | I48: 7.5366 | J48: 66 | K48: 2.2000000000000002 | L48: 0.7 | M48: =(RC[-10]*RC[-6])/RC[-4] -> 43.391231048483405
A49: 89 | B49: -0.48 | C49: -1345.97 | D49: -44.865667000000002 | E49: 0.83859099999999998 | F49: -0.59769099999999997 | G49: -0.48009099999999999 | H49: 0 | I49: 14.9589 | J49: 30 | K49: 1.6 | L49: 2 | M49: =(RC[-10]*RC[-6])/RC[-4] -> 43.19756688459713
A50: 114 | B50: 0.54 | C50: 71.290000000000006 | D50: 1.2730360000000001 | E50: 1.0774189999999999 | F50: 0.50346000000000002 | G50: 0.53587499999999999 | H50: 0 | I50: 0.93140000000000001 | J50: 56 | K50: 2.2000000000000002 | L50: 0.1 | M50: =(RC[-10]*RC[-6])/RC[-4] -> 41.016243021258326
A51: 42 | B51: -0.62 | C51: -334.76 | D51: -8.8094739999999998 | E51: 0.90582200000000002 | F51: -0.40733999999999998 | G51: -0.62207299999999999 | H51: 0 | I51: 5.3087 | J51: 38 | K51: 2.6 | L51: 0.6 | M51: =(RC[-10]*RC[-6])/RC[-4] -> 39.227147414621278
A52: 102 | B52: 0.54 | C52: 903.42 | D52: 18.0684 | E52: 1.0687979999999999 | F52: 0.33718300000000001 | G52: 0.53929400000000005 | H52: 0 | I52: 14.4346 | J52: 50 | K52: 2.5 | L52: 1.7 | M52: =(RC[-10]*RC[-6])/RC[-4] -> 33.752856710958397
A53: 146 | B53: 0.32 | C53: 517.75 | D53: 19.913461999999999 | E53: 1.1351119999999999 | F53: 0.663663 | G53: 0.318942 | H53: 0 | I53: 5.1955999999999998 | J53: 26 | K53: 0 | L53: 1.2 | M53: =(RC[-10]*RC[-6])/RC[-4] -> 31.783089633536068
A54: 123 | B54: 0.32 | C54: 517.75 | D54: 19.913461999999999 | E54: 1.1351119999999999 | F54: 0.663663 | G54: 0.318942 | H54: 0 | I54: 5.1955999999999998 | J54: 26 | K54: 0.7 | L54: 1.2 | M54: =(RC[-10]*RC[-6])/RC[-4] -> 31.783089633536068
A55: 46 | B55: 0.32 | C55: 517.75 | D55: 19.913461999999999 | E55: 1.1351119999999999 | F55: 0.663663 | G55: 0.318942 | H55: 0 | I55: 5.1955999999999998 | J55: 26 | K55: 0.1 | L55: 1.2 | M55: =(RC[-10]*RC[-6])/RC[-4] -> 31.783089633536068
A56: 26 | B56: 0.32 | C56: 159.80000000000001 | D56: 6.1461540000000001 | E56: 1.12615 | F56: 0.63375000000000004 | G56: 0.31933899999999998 | H56: 0 | I56: 1.6805000000000001 | J56: 26 | K56: 0.6 | L56: 0.4 | M56: =(RC[-10]*RC[-6])/RC[-4] -> 30.366183992859266
A57: 2 | B57: 0.12 | C57: 480.4 | D57: 240.2 | E57: 2.866501 | F57: 1.608895 | G57: 0.120431 | H57: 0 | I57: 1.9354 | J57: 2 | K57: 3.8 | L57: 1.6 | M57: =(RC[-10]*RC[-6])/RC[-4] -> 29.893072439805724
A58: 126 | B58: 0.31 | C58: 279.76 | D58: 10.76 | E58: 1.1246659999999999 | F58: 0.62014499999999995 | G58: 0.30910599999999999 | H58: 0 | I58: 3.0057999999999998 | J58: 26 | K58: 0 | L58: 0.7 | M58: =(RC[-10]*RC[-6])/RC[-4] -> 28.76954373544481
A59: 10 | B59: 0.31 | C59: 279.76 | D59: 10.76 | E59: 1.1246659999999999 | F59: 0.62014499999999995 | G59: 0.30910599999999999 | H59: 0 | I59: 3.0057999999999998 | J59: 26 | K59: 0.3 | L59: 0.7 | M59: =(RC[-10]*RC[-6])/RC[-4] -> 28.76954373544481
A60: 52 | B60: 0.33 | C60: 121.47 | D60: 5.0612500000000002 | E60: 1.139778 | F60: 0.55779000000000001 | G60: 0.32799099999999998 | H60: 0 | I60: 1.4514 | J60: 24 | K60: 0.8 | L60: 0.3 | M60: =(RC[-10]*RC[-6])/RC[-4] -> 27.450094233154193
A61: 41 | B61: 0.33 | C61: 121.47 | D61: 5.0612500000000002 | E61: 1.139778 | F61: 0.55779000000000001 | G61: 0.32799099999999998 | H61: 0 | I61: 1.4514 | J61: 24 | K61: 0 | L61: 0.3 | M61: =(RC[-10]*RC[-6])/RC[-4] -> 27.450094233154193
A62: 11 | B62: 0.33 | C62: 121.47 | D62: 5.0612500000000002 | E62: 1.139778 | F62: 0.55779000000000001 | G62: 0.32799099999999998 | H62: 0 | I62: 1.4514 | J62: 24 | K62: 0.5 | L62: 0.3 | M62: =(RC[-10]*RC[-6])/RC[-4] -> 27.450094233154193
A63: 83 | B63: 0.33 | C63: 121.47 | D63: 5.0612500000000002 | E63: 1.139778 | F63: 0.55779000000000001 | G63: 0.32799099999999998 | H63: 0 | I63: 1.4514 | J63: 24 | K63: 0.6 | L63: 0.3 | M63: =(RC[-10]*RC[-6])/RC[-4] -> 27.450094233154193
A64: 141 | B64: 0.28999999999999998 | C64: 433.41 | D64: 16.669615 | E64: 1.1258760000000001 | F64: 0.60218400000000005 | G64: 0.29240300000000002 | H64: 0 | I64: 4.7941000000000003 | J64: 26 | K64: 0 | L64: 1.1000000000000001 | M64: =(RC[-10]*RC[-6])/RC[-4] -> 26.434655979224466
A65: 31 | B65: 0.48 | C65: 49.49 | D65: 1.031042 | E65: 1.066703 | F65: 0.32896799999999998 | G65: 0.47656999999999999 | H65: 0 | I65: 0.99039999999999995 | J65: 48 | K65: 2.4 | L65: 0.1 | M65: =(RC[-10]*RC[-6])/RC[-4] -> 23.8140643174475
A66: 5 | B66: -0.45 | C66: -13.78 | D66: -1.3124E-2 | E66: 0.98582199999999998 | F66: -0.33593400000000001 | G66: -0.45025900000000002 | H66: 0 | I66: 0.2732 | J66: 1050 | K66: 0.8 | L66: 0 | M66: =(RC[-10]*RC[-6])/RC[-4] -> 22.710721156661787
A67: 128 | B67: 0.31 | C67: 811.02 | D67: 15.596538000000001 | E67: 1.0687610000000001 | F67: 0.41706900000000002 | G67: 0.311475 | H67: 0 | I67: 11.4932 | J67: 52 | K67: 0 | L67: 1.5 | M67: =(RC[-10]*RC[-6])/RC[-4] -> 21.97929684509101
A68: 56 | B68: 0.31 | C68: 811.02 | D68: 15.596538000000001 | E68: 1.0687610000000001 | F68: 0.41706900000000002 | G68: 0.311475 | H68: 0 | I68: 11.4932 | J68: 52 | K68: 0.3 | L68: 1.5 | M68: =(RC[-10]*RC[-6])/RC[-4] -> 21.97929684509101
A69: 121 | B69: 0.28999999999999998 | C69: 1472.71 | D69: 24.545166999999999 | E69: 1.0555559999999999 | F69: 0.40377800000000003 | G69: 0.28806599999999999 | H69: 0 | I69: 19.658799999999999 | J69: 60 | K69: 0.2 | L69: 2.7 | M69: =(RC[-10]*RC[-6])/RC[-4] -> 21.580039415427191
A70: 3 | B70: -0.26 | C70: -989.4 | D70: -164.9 | E70: 0.68323199999999995 | F70: -0.494925 | G70: -0.25616800000000001 | H70: 0 | I70: 12.6029 | J70: 6 | K70: 3.2 | L70: 2.5 | M70: =(RC[-10]*RC[-6])/RC[-4] -> 20.110658594450484
A71: 145 | B71: 0.43 | C71: 839.98 | D71: 14.999643000000001 | E71: 1.0573589999999999 | F71: 0.23924500000000001 | G71: 0.42813200000000001 | H71: 0 | I71: 18.3292 | J71: 56 | K71: 2.4 | L71: 1.7 | M71: =(RC[-10]*RC[-6])/RC[-4] -> 19.62018622525806
A72: 81 | B72: 0.34 | C72: 641.98 | D72: 8.2305130000000002 | E72: 1.047245 | F72: 0.29685600000000001 | G72: 0.34084900000000001 | H72: 0 | I72: 13.059200000000001 | J72: 78 | K72: 2 | L72: 1 | M72: =(RC[-10]*RC[-6])/RC[-4] -> 16.755868737748102
A73: 17 | B73: -0.19 | C73: -738.93 | D73: -123.155 | E73: 0.71845000000000003 | F73: -0.49089500000000003 | G73: -0.18714700000000001 | H73: 0 | I73: 9.6158999999999999 | J73: 6 | K73: 3.5 | L73: 1.9 | M73: =(RC[-10]*RC[-6])/RC[-4] -> 14.381236567559979
A74: 29 | B74: -0.19 | C74: -508.67 | D74: -84.778333000000003 | E74: 0.71678699999999995 | F74: -0.49349500000000002 | G74: -0.18703600000000001 | H74: 0 | I74: 6.6734 | J74: 6 | K74: 3.5 | L74: 1.3 | M74: =(RC[-10]*RC[-6])/RC[-4] -> 14.256541211376511
A75: 67 | B75: 0.28000000000000003 | C75: 38.35 | D75: 0.871591 | E75: 1.0558270000000001 | F75: 0.32744200000000001 | G75: 0.279331 | H75: 0 | I75: 0.78039999999999998 | J75: 44 | K75: 1.8 | L75: 0.1 | M75: =(RC[-10]*RC[-6])/RC[-4] -> 13.726734815479242
A76: 124 | B76: 0.31 | C76: 83.41 | D76: 1.737708 | E76: 1.0496540000000001 | F76: 0.26082699999999998 | G76: 0.30925599999999998 | H76: 0 | I76: 2.0790000000000002 | J76: 48 | K76: 2.2999999999999998 | L76: 0.2 | M76: =(RC[-10]*RC[-6])/RC[-4] -> 12.407428071188068
A77: 117 | B77: -0.24 | C77: -1084.23 | D77: -25.815000000000001 | E77: 0.94392900000000002 | F77: -0.27037 | G77: -0.24296799999999999 | H77: 0 | I77: 25.483699999999999 | J77: 42 | K77: 1.9 | L77: 2.7 | M77: =(RC[-10]*RC[-6])/RC[-4] -> 10.337321293218803
A78: 130 | B78: 0.17 | C78: 106.39 | D78: 3.7996430000000001 | E78: 1.0612809999999999 | F78: 0.33260400000000001 | G78: 0.17105000000000001 | H78: 0 | I78: 2.1316999999999999 | J78: 28 | K78: 0 | L78: 0.5 | M78: =(RC[-10]*RC[-6])/RC[-4] -> 8.5368529811887228
A79: 36 | B79: -0.12 | C79: -353.87 | D79: -58.978332999999999 | E79: 0.76832 | F79: -0.46009699999999998 | G79: -0.120447 | H79: 0 | I79: 5.0086000000000004 | J79: 6 | K79: 3.4 | L79: 1 | M79: =(RC[-10]*RC[-6])/RC[-4] -> 8.509878986143832
A80: 62 | B80: 0.25 | C80: 296.48 | D80: 4.9413330000000002 | E80: 1.038735 | F80: 0.20608899999999999 | G80: 0.24712200000000001 | H80: 0 | I80: 8.6417999999999999 | J80: 60 | K80: 2.2999999999999998 | L80: 0.8 | M80: =(RC[-10]*RC[-6])/RC[-4] -> 8.4781793792959821
A81: 86 | B81: -0.11 | C81: -267.52 | D81: -44.586666999999998 | E81: 0.78082600000000002 | F81: -0.43895299999999998 | G81: -0.11273 | H81: 0 | I81: 3.9847999999999999 | J81: 6 | K81: 3.3 | L81: 0.8 | M81: =(RC[-10]*RC[-6])/RC[-4] -> 7.568141337080907
A82: 38 | B82: 0.19 | C82: 1197.43 | D82: 13.923605 | E82: 1.034845 | F82: 0.24884899999999999 | G82: 0.19132399999999999 | H82: 0 | I82: 30.578299999999999 | J82: 86 | K82: 1.7 | L82: 2.7 | M82: =(RC[-10]*RC[-6])/RC[-4] -> 7.4921463037513538
A83: 131 | B83: -0.11 | C83: -194.8 | D83: -32.466667000000001 | E83: 0.78156800000000004 | F83: -0.43323499999999998 | G83: -0.11344899999999999 | H83: 0 | I83: 2.9544999999999999 | J83: 6 | K83: 3.2 | L83: 0.6 | M83: =(RC[-10]*RC[-6])/RC[-4] -> 7.4800694533762062
A84: 106 | B84: -0.15 | C84: -169.18 | D84: -3.8450000000000002 | E84: 0.97078600000000004 | F84: -0.29712 | G84: -0.14643400000000001 | H84: 0 | I84: 3.722 | J84: 44 | K84: 0.7 | L84: 0.8 | M84: =(RC[-10]*RC[-6])/RC[-4] -> 6.6560193766792048
A85: 70 | B85: -0.08 | C85: -100.85 | D85: -16.808333000000001 | E85: 0.81139300000000003 | F85: -0.45718300000000001 | G85: -7.5969999999999996E-2 | H85: 0 | I85: 1.4607000000000001 | J85: 6 | K85: 3.3 | L85: 0.3 | M85: =(RC[-10]*RC[-6])/RC[-4] -> 5.2451389744642976
A86: 32 | B86: -0.13 | C86: -143.9 | D86: -3.2704550000000001 | E86: 0.97480900000000004 | F86: -0.26446399999999998 | G86: -0.12527099999999999 | H86: 0 | I86: 3.5567000000000002 | J86: 44 | K86: 0.5 | L86: 0.8 | M86: =(RC[-10]*RC[-6])/RC[-4] -> 5.0683208873393877
A87: 143 | B87: 0.13 | C87: 462.34 | D87: 9.2468000000000004 | E87: 1.0252520000000001 | F87: 0.202677 | G87: 0.127163 | H87: 0 | I87: 13.059100000000001 | J87: 50 | K87: 0 | L87: 2.4 | M87: =(RC[-10]*RC[-6])/RC[-4] -> 4.5020362368003921
A88: 49 | B88: 0.16 | C88: 222.85 | D88: 4.4569999999999999 | E88: 1.0353399999999999 | F88: 0.17871600000000001 | G88: 0.15603 | H88: 0 | I88: 8.1847999999999992 | J88: 50 | K88: 1.9 | L88: 0.8 | M88: =(RC[-10]*RC[-6])/RC[-4] -> 4.2482755229205358
A89: 39 | B89: -7.0000000000000007E-2 | C89: -57.96 | D89: -9.66 | E89: 0.83306500000000006 | F89: -0.41854400000000003 | G89: -6.5592999999999999E-2 | H89: 0 | I89: 0.91900000000000004 | J89: 6 | K89: 3.3 | L89: 0.2 | M89: =(RC[-10]*RC[-6])/RC[-4] -> 4.1368555821545154
A90: 69 | B90: -0.15 | C90: -701.54 | D90: -13.491154 | E90: 0.97262099999999996 | F90: -0.125331 | G90: -0.14782899999999999 | H90: 0 | I90: 29.311399999999999 | J90: 52 | K90: 1.3 | L90: 3 | M90: =(RC[-10]*RC[-6])/RC[-4] -> 3.5381440893304306
A91: 13 | B91: -0.14000000000000001 | C91: -371.81 | D91: -6.4105169999999996 | E91: 0.97274000000000005 | F91: -0.14412900000000001 | G91: -0.144786 | H91: 0 | I91: 15.239699999999999 | J91: 58 | K91: 1 | L91: 1.5 | M91: =(RC[-10]*RC[-6])/RC[-4] -> 3.5324109175377472
A92: 147 | B92: 0.11 | C92: 391.68 | D92: 7.8335999999999997 | E92: 1.02189 | F92: 0.186167 | G92: 0.10677399999999999 | H92: 0 | I92: 12.1945 | J92: 50 | K92: 0 | L92: 2.2999999999999998 | M92: =(RC[-10]*RC[-6])/RC[-4] -> 3.4295166115871911
A93: 134 | B93: 0.11 | C93: 391.68 | D93: 7.8335999999999997 | E93: 1.02189 | F93: 0.186167 | G93: 0.10677399999999999 | H93: 0 | I93: 12.1945 | J93: 50 | K93: 0.3 | L93: 2.2999999999999998 | M93: =(RC[-10]*RC[-6])/RC[-4] -> 3.4295166115871911
A94: 138 | B94: -0.15 | C94: -158.16 | D94: -3.5945450000000001 | E94: 0.97111099999999995 | F94: -0.1333 | G94: -0.14697299999999999 | H94: 0 | I94: 7.5430999999999999 | J94: 44 | K94: 1.2 | L94: 0.7 | M94: =(RC[-10]*RC[-6])/RC[-4] -> 3.0816573663347957
A95: 119 | B95: 0.11 | C95: 589.72 | D95: 10.167586 | E95: 1.0211330000000001 | F95: 0.13725799999999999 | G95: 0.114317 | H95: 0 | I95: 22.080500000000001 | J95: 58 | K95: 1.1000000000000001 | L95: 2.8 | M95: =(RC[-10]*RC[-6])/RC[-4] -> 3.0531474033649602
A96: 133 | B96: 0.09 | C96: 157.19 | D96: 5.6139289999999997 | E96: 1.0318419999999999 | F96: 0.172152 | G96: 8.5980000000000001E-2 | H96: 0 | I96: 6.0804999999999998 | J96: 28 | K96: 0.7 | L96: 1.4 | M96: =(RC[-10]*RC[-6])/RC[-4] -> 2.2227113230819833
A97: 24 | B97: 0.09 | C97: 157.19 | D97: 5.6139289999999997 | E97: 1.0318419999999999 | F97: 0.172152 | G97: 8.5980000000000001E-2 | H97: 0 | I97: 6.0804999999999998 | J97: 28 | K97: 0.3 | L97: 1.4 | M97: =(RC[-10]*RC[-6])/RC[-4] -> 2.2227113230819833
A98: 115 | B98: 0.08 | C98: 402.79 | D98: 4.683605 | E98: 1.0136400000000001 | F98: 0.128302 | G98: 8.1911999999999999E-2 | H98: 0 | I98: 20.846299999999999 | J98: 86 | K98: 1.6 | L98: 2.2000000000000002 | M98: =(RC[-10]*RC[-6])/RC[-4] -> 1.5826949856809123
A99: 64 | B99: 0.06 | C99: 154.51 | D99: 5.5182140000000004 | E99: 1.0250269999999999 | F99: 0.13886000000000001 | G99: 6.4377000000000004E-2 | H99: 0 | I99: 7.4069000000000003 | J99: 28 | K99: 0.9 | L99: 1.7 | M99: =(RC[-10]*RC[-6])/RC[-4] -> 1.3429221766190984
A100: 65 | B100: 0.06 | C100: 143.28 | D100: 5.1171430000000004 | E100: 1.021693 | F100: 0.12245300000000001 | G100: 5.6529999999999997E-2 | H100: 0 | I100: 7.7885 | J100: 28 | K100: 1 | L100: 1.8 | M100: =(RC[-10]*RC[-6])/RC[-4] -> 1.0399458689092893
A101: 109 | B101: 7.0000000000000007E-2 | C101: 126.3 | D101: 2.4288460000000001 | E101: 1.014958 | F101: 7.9722000000000001E-2 | G101: 7.4439000000000005E-2 | H101: 0 | I101: 9.6975999999999996 | J101: 52 | K101: 1.3 | L101: 1 | M101: =(RC[-10]*RC[-6])/RC[-4] -> 0.96948169650222749
A102: 23 | B102: 0.08 | C102: 1.82 | D102: 2.5999999999999999E-3 | E102: 1.0027740000000001 | F102: 5.2646999999999999E-2 | G102: 8.3974999999999994E-2 | H102: 0 | I102: 0.2301 | J102: 700 | K102: 1.2 | L102: 0 | M102: =(RC[-10]*RC[-6])/RC[-4] -> 0.66420903954802257
A103: 44 | B103: 7.0000000000000007E-2 | C103: 0.2 | D103: 0.1 | E103: 1.5882350000000001 | F103: 5.7971000000000002E-2 | G103: 7.2471999999999995E-2 | H103: 0 | I103: 2.3E-2 | J103: 2 | K103: 3.8 | L103: 0 | M103: =(RC[-10]*RC[-6])/RC[-4] -> 0.63019130434782611
A104: 135 | B104: -0.03 | C104: -69.66 | D104: -2.3220000000000001 | E104: 0.98890299999999998 | F104: -6.1122000000000003E-2 | G104: -3.1018E-2 | H104: 0 | I104: 7.22 | J104: 30 | K104: 0 | L104: 1.6 | M104: =(RC[-10]*RC[-6])/RC[-4] -> 0.29926785041551246
A105: 45 | B105: -0.02 | C105: -82.43 | D105: -20.607500000000002 | E105: 0.92219799999999996 | F105: -8.5373000000000004E-2 | G105: -2.1000999999999999E-2 | H105: 0 | I105: 6.1375999999999999 | J105: 4 | K105: 3.6 | L105: 2.1 | M105: =(RC[-10]*RC[-6])/RC[-4] -> 0.28205038288581857
A106: 4 | B106: -0.01 | C106: -48.53 | D106: -12.1325 | E106: 0.94136299999999995 | F106: -8.2770999999999997E-2 | G106: -1.3705E-2 | H106: 0 | I106: 3.7959999999999998 | J106: 4 | K106: 3.7 | L106: 1.3 | M106: =(RC[-10]*RC[-6])/RC[-4] -> 0.17521170969441519
A107: 50 | B107: -0.02 | C107: -36.229999999999997 | D107: -0.86261900000000002 | E107: 0.99736899999999995 | F107: -1.0330000000000001E-2 | G107: -1.9115E-2 | H107: 0 | I107: 19.014800000000001 | J107: 42 | K107: 2.6 | L107: 2.2999999999999998 | M107: =(RC[-10]*RC[-6])/RC[-4] -> 3.6420916864757971E-2
A108: 148 | B108: -0.01 | C108: -29.53 | D108: -0.56788499999999997 | E108: 0.99839599999999995 | F108: -1.0515999999999999E-2 | G108: -7.9190000000000007E-3 | H108: 0 | I108: 16.031300000000002 | J108: 52 | K108: 0 | L108: 2.2000000000000002 | M108: =(RC[-10]*RC[-6])/RC[-4] -> 1.4586968617641739E-2
A109: 98 | B109: -0.01 | C109: -29.53 | D109: -0.56788499999999997 | E109: 0.99839599999999995 | F109: -1.0515999999999999E-2 | G109: -7.9190000000000007E-3 | H109: 0 | I109: 16.031300000000002 | J109: 52 | K109: 0.1 | L109: 2.2000000000000002 | M109: =(RC[-10]*RC[-6])/RC[-4] -> 1.4586968617641739E-2
A110: 19 | B110: -0.01 | C110: -13.65 | D110: -0.32500000000000001 | E110: 0.99871799999999999 | F110: -5.084E-3 | G110: -9.214E-3 | H110: 0 | I110: 15.2105 | J110: 42 | K110: 2.6 | L110: 1.8 | M110: =(RC[-10]*RC[-6])/RC[-4] -> 8.2687025410078559E-3
A111: 47 | B111: 0 | C111: 7.97 | D111: 1.9924999999999999 | E111: 1.006634 | F111: 1.0884E-2 | G111: 1.266E-3 | H111: 0 | I111: 4.7233999999999998 | J111: 4 | K111: 3.6 | L111: 1.5 | M111: =(RC[-10]*RC[-6])/RC[-4] -> 2.1361773298894863E-3
A112: 82 | B112: 0 | C112: 0.51 | D112: 2.8333000000000001E-2 | E112: 1.0010889999999999 | F112: 3.8449999999999999E-3 | G112: 1.755E-3 | H112: 0 | I112: 0.88429999999999997 | J112: 18 | K112: 1.1000000000000001 | L112: 0.2 | M112: =(RC[-10]*RC[-6])/RC[-4] -> 1.0121565079724076E-3
A113: 55 | B113: 0 | C113: -0.42 | D113: -2.3333E-2 | E113: 0.99916099999999997 | F113: -3.166E-3 | G113: -1.4040000000000001E-3 | H113: 0 | I113: 0.88429999999999997 | J113: 18 | K113: 0.9 | L113: 0.2 | M113: =(RC[-10]*RC[-6])/RC[-4] -> 6.6683252289946853E-4